{
  "story_id": "us-15",
  "epic_id": "epic-6",
  "role": "любой пользователь (в т.ч. с нарушениями зрения)",
  "capability": "корректные a11y-паттерны (VoiceOver/клавиатура/DT)",
  "value": "эффективно пользоваться приложением",
  "priority": "medium",
  "status": "proposed",
  "acceptance_criteria": [
    "Given диалог ошибки When открыт Then роль alertdialog, фокус на сообщении, live_region=assertive (FLOW:#error-entry-save; PRD:#10)",
    "Given экран подписи When активен Then порядок фокуса: canvas → Confirm (FLOW:#report-sign; PRD:#10)",
    "Given Dynamic Type When увеличен шрифт Then тексты не обрезаются, таргеты ≥44 pt (PRD:#10)"
  ],
  "metrics": {
    "leading": [
      {
        "name": "A11y issues per release",
        "kpi_ref": "PRD:#11"
      }
    ],
    "lagging": [
      {
        "name": "Task success (a11y cohort)",
        "kpi_ref": "PRD:#11"
      }
    ]
  },
  "nfr": {
    "accessibility": "WCAG AA; порядок фокуса; контраст; Dynamic Type",
    "localization": "RTL и выдерживание длин строк"
  },
  "dependencies": {
    "blocked_by": [],
    "relates_to": [
      "us-4",
      "us-9"
    ]
  },
  "risks": [
    {
      "desc": "Регрессии фокуса",
      "severity": "medium",
      "refs": []
    }
  ],
  "refs": [
    "PRD:#10",
    "PRD:#11",
    "FLOW:#error-entry-save",
    "FLOW:#report-sign"
  ],
  "affects_mot": false,
  "mot_refs": [],
  "analytics_events": [
    "error_entry_save",
    "tap_sign"
  ],
  "analytics_owner": "Product",
  "analytics_pii": false,
  "story_points": 3,
  "estimate_confidence": "high",
  "assumptions": []
}
