{
  "story_id": "us-10",
  "epic_id": "epic-3",
  "role": "руководитель стройплощадки",
  "capability": "экспорт подписанного отчёта через iOS Share Sheet с ретраями",
  "value": "быстро отправить отчёт",
  "priority": "high",
  "status": "proposed",
  "acceptance_criteria": [
    "Given подписанный отчёт When открываю «Экспорт» Then вижу PDF/A-2u по умолчанию и системные каналы (FLOW:#export-decision; PRD:#4_2, PRD:#9)",
    "Given генерация When таймаут Then до 3 ретраев с backoff и понятным диalogом (FLOW:#export-generate, FLOW:#export-error; PRD:#9)",
    "Given отмена When нажимаю «Отмена» Then возвращаюсь в превью подписанного отчёта (FLOW:#report-preview-signed; PRD:#9)"
  ],
  "metrics": {
    "leading": [
      {
        "name": "Export Options View",
        "kpi_ref": "PRD:#11"
      },
      {
        "name": "Export Retry Rate",
        "kpi_ref": "PRD:#11"
      }
    ],
    "lagging": [
      {
        "name": "Export Success/Error Rate",
        "kpi_ref": "PRD:#11"
      },
      {
        "name": "Time to Report",
        "kpi_ref": "PRD:#11"
      }
    ]
  },
  "nfr": {
    "performance": "Генерация + Share Sheet ≤2 с",
    "security_privacy": "Без PII",
    "accessibility": "Озвучки диалогов ошибок"
  },
  "dependencies": {
    "blocked_by": [],
    "relates_to": []
  },
  "risks": [
    {
      "desc": "OOM при генерации больших PDF",
      "severity": "medium",
      "refs": [
        "PRD:#9"
      ]
    }
  ],
  "refs": [
    "PRD:#4_2",
    "PRD:#9",
    "PRD:#11",
    "CJM:#reporting-signoff",
    "FLOW:#export-decision",
    "FLOW:#export-generate",
    "FLOW:#export-error",
    "FLOW:#report-preview-signed"
  ],
  "affects_mot": true,
  "mot_refs": [
    "CJM:#reporting-signoff"
  ],
  "analytics_events": [
    "export_options_view",
    "export_process_started",
    "report_exported",
    "export_failed",
    "export_retry",
    "export_abort"
  ],
  "analytics_owner": "Product",
  "analytics_pii": false,
  "story_points": 3,
  "estimate_confidence": "high",
  "assumptions": []
}
