{
  "story_id": "us-7",
  "epic_id": "epic-2",
  "role": "пользователь, ранее отклонивший доступ к камере",
  "capability": "инструкции и быстрый переход в Настройки для разблокировки фото",
  "value": "разблокировать фото",
  "priority": "medium",
  "status": "proposed",
  "acceptance_criteria": [
    "Given отказ камеры When пытаюсь прикрепить фото Then вижу диалог с «Открыть Настройки» / «Продолжить без фото» (FLOW:#camera-permission-error; PRD:#9)",
    "Given VoiceOver When открыт диалог Then корректные озвучки и фокус на сообщении (PRD:#10)"
  ],
  "metrics": {
    "leading": [
      {
        "name": "Permission Grant Rate",
        "kpi_ref": "PRD:#11"
      }
    ],
    "lagging": [
      {
        "name": "Доля дней с журналом",
        "kpi_ref": "PRD:#11"
      }
    ]
  },
  "nfr": {
    "accessibility": "Alertdialog, live region, корректные ярлыки",
    "localization": "Тексты/кнопки локализованы"
  },
  "dependencies": {
    "blocked_by": [],
    "relates_to": [
      "us-6"
    ]
  },
  "risks": [],
  "refs": [
    "PRD:#9",
    "PRD:#10",
    "PRD:#11",
    "FLOW:#camera-permission-error"
  ],
  "affects_mot": false,
  "mot_refs": [],
  "analytics_events": [
    "camera_permission_error_view",
    "open_settings_camera",
    "continue_without_photo"
  ],
  "analytics_owner": "Product",
  "analytics_pii": false,
  "story_points": 2,
  "estimate_confidence": "high",
  "assumptions": []
}
