{
  "story_id": "us-14",
  "epic_id": "epic-5",
  "role": "руководитель стройплощадки",
  "capability": "галерею с группировкой по дням и массовыми действиями",
  "value": "отслеживать прогресс и быстро прикреплять медиа",
  "priority": "medium",
  "status": "proposed",
  "acceptance_criteria": [
    "Given дашборд When открываю «Галерея» Then вижу альбом, сгруппированный по датам (PRD:#4_4)",
    "Given фильтр When выбираю дату Then показываются фото этого дня",
    "Given множественный выбор When жму «Добавить к отчёту» Then выбранные фото прикрепляются к выбранному дню"
  ],
  "metrics": {
    "leading": [
      {
        "name": "Gallery views",
        "kpi_ref": "PRD:#11"
      },
      {
        "name": "Bulk attach rate",
        "kpi_ref": "PRD:#11"
      }
    ],
    "lagging": [
      {
        "name": "Time to Report",
        "kpi_ref": "PRD:#11"
      }
    ]
  },
  "nfr": {
    "performance": "Плавная прокрутка/загрузка миниатюр",
    "security_privacy": "Защита медиафайлов в покое",
    "accessibility": "Доступность выбора и множественного выбора"
  },
  "dependencies": {
    "blocked_by": [],
    "relates_to": [
      "us-6",
      "us-10"
    ]
  },
  "risks": [
    {
      "desc": "Рост размера бандла/кеша",
      "severity": "medium",
      "refs": []
    }
  ],
  "refs": [
    "PRD:#4_4",
    "PRD:#11"
  ],
  "affects_mot": false,
  "mot_refs": [],
  "analytics_events": [
    "gallery_view",
    "gallery_bulk_attach"
  ],
  "analytics_owner": "Product",
  "analytics_pii": false,
  "story_points": 3,
  "estimate_confidence": "medium",
  "assumptions": []
}
